{
  "$schema": "strategy",
  "name": "Angle Reinvest",
  "description": "Supplies {{token}} to [Angle Protocol](https://app.angle.money/#/slp) as a Standard Liquidity Provider for sanTokens which are staked to earn ANGLE. Earned tokens are harvested, sold for more {{token}} which is deposited back into the strategy.",
  "addresses": [
    "0xcFa730D6CD6568872C18101442228499229fb70E",
    "0x98fBB6Fd927bE3a98563E66E1ef8Ae0C2016505F",
    "0x2CB390212b0e5091a3c0D0331669c1419165CF80",
    "0x7C2b9DB2Ae5aCC6fAC2Fd6cE9b01A5EB4bDD1309"
  ],
  "protocols": ["Angle"],
  "protocolVersion": {
    "Angle": "1"
  },
  "localization": {
    "en": {
      "name": "Angle Reinvest",
      "description": "Supplies {{token}} to [Angle Protocol](https://app.angle.money/#/slp) as a Standard Liquidity Provider for sanTokens which are staked to earn ANGLE. Earned tokens are harvested, sold for more {{token}} which is deposited back into the strategy."
    },
    "fr": {
      "name": "Angle Reinvest",
      "description": "Supplies {{token}} to [Angle Protocol](https://app.angle.money/#/slp) as a Standard Liquidity Provider for sanTokens which are staked to earn ANGLE. Earned tokens are harvested, sold for more {{token}} which is deposited back into the strategy."
    },
    "es": {
      "name": "Angle Reinvest",
      "description": "Supplies {{token}} to [Angle Protocol](https://app.angle.money/#/slp) as a Standard Liquidity Provider for sanTokens which are staked to earn ANGLE. Earned tokens are harvested, sold for more {{token}} which is deposited back into the strategy."
    },
    "de": {
      "name": "Angle Reinvest",
      "description": "Supplies {{token}} to [Angle Protocol](https://app.angle.money/#/slp) as a Standard Liquidity Provider for sanTokens which are staked to earn ANGLE. Earned tokens are harvested, sold for more {{token}} which is deposited back into the strategy."
    },
    "pt": {
      "name": "Angle Reinvest",
      "description": "Supplies {{token}} to [Angle Protocol](https://app.angle.money/#/slp) as a Standard Liquidity Provider for sanTokens which are staked to earn ANGLE. Earned tokens are harvested, sold for more {{token}} which is deposited back into the strategy."
    },
    "el": {
      "name": "Angle Reinvest",
      "description": "Supplies {{token}} to [Angle Protocol](https://app.angle.money/#/slp) as a Standard Liquidity Provider for sanTokens which are staked to earn ANGLE. Earned tokens are harvested, sold for more {{token}} which is deposited back into the strategy."
    },
    "tr": {
      "name": "Angle Reinvest",
      "description": "Supplies {{token}} to [Angle Protocol](https://app.angle.money/#/slp) as a Standard Liquidity Provider for sanTokens which are staked to earn ANGLE. Earned tokens are harvested, sold for more {{token}} which is deposited back into the strategy."
    },
    "vi": {
      "name": "Angle Reinvest",
      "description": "Supplies {{token}} to [Angle Protocol](https://app.angle.money/#/slp) as a Standard Liquidity Provider for sanTokens which are staked to earn ANGLE. Earned tokens are harvested, sold for more {{token}} which is deposited back into the strategy."
    },
    "zh": {
      "name": "Angle Reinvest",
      "description": "存入 {{token}} 到 [Angle Protocol](https://app.angle.money/#/slp) 做 sanToken 的流动性提供者，然后做质押以赚取 ANGLE。赚取到的代币被收获后，卖掉换为更多的 {{token}} 再进行复投。"
    },
    "hi": {
      "name": "Angle Reinvest",
      "description": "Supplies {{token}} to [Angle Protocol](https://app.angle.money/#/slp) as a Standard Liquidity Provider for sanTokens which are staked to earn ANGLE. Earned tokens are harvested, sold for more {{token}} which is deposited back into the strategy."
    },
    "ja": {
      "name": "Angle Reinvest",
      "description": "Supplies {{token}} to [Angle Protocol](https://app.angle.money/#/slp) as a Standard Liquidity Provider for sanTokens which are staked to earn ANGLE. Earned tokens are harvested, sold for more {{token}} which is deposited back into the strategy."
    },
    "id": {
      "name": "Angle Reinvest",
      "description": "Supplies {{token}} to [Angle Protocol](https://app.angle.money/#/slp) as a Standard Liquidity Provider for sanTokens which are staked to earn ANGLE. Earned tokens are harvested, sold for more {{token}} which is deposited back into the strategy."
    },
    "ru": {
      "name": "Angle Reinvest",
      "description": "Supplies {{token}} to [Angle Protocol](https://app.angle.money/#/slp) as a Standard Liquidity Provider for sanTokens which are staked to earn ANGLE. Earned tokens are harvested, sold for more {{token}} which is deposited back into the strategy."
    }
  }
}
