{
  "$schema": "strategy",
  "name": "Aave Lender Optimizer",
  "description": "Supplies {{token}} to [AAVE v3](https://app.aave.com/home) to generate interest and earn OP tokens. Earned tokens are harvested, sold for more {{token}} which is deposited back into the strategy.",
  "addresses": ["0x1d3BE43C5621bdA29aB24101c54d434B9b3f29c8"],
  "protocols": ["Aave"],
  "protocolVersion": {
    "Aave": "3"
  },
  "localization": {
    "en": {
      "name": "Aave Lender Optimizer",
      "description": "Supplies {{token}} to [AAVE v3](https://app.aave.com/home) to generate interest and earn OP tokens. Earned tokens are harvested, sold for more {{token}} which is deposited back into the strategy."
    },
    "fr": {
      "name": "Aave Lender Optimizer",
      "description": "Supplies {{token}} to [AAVE v3](https://app.aave.com/home) to generate interest and earn OP tokens. Earned tokens are harvested, sold for more {{token}} which is deposited back into the strategy."
    },
    "es": {
      "name": "Aave Lender Optimizer",
      "description": "Supplies {{token}} to [AAVE v3](https://app.aave.com/home) to generate interest and earn OP tokens. Earned tokens are harvested, sold for more {{token}} which is deposited back into the strategy."
    },
    "de": {
      "name": "Aave Lender Optimizer",
      "description": "Supplies {{token}} to [AAVE v3](https://app.aave.com/home) to generate interest and earn OP tokens. Earned tokens are harvested, sold for more {{token}} which is deposited back into the strategy."
    },
    "pt": {
      "name": "Aave Lender Optimizer",
      "description": "Supplies {{token}} to [AAVE v3](https://app.aave.com/home) to generate interest and earn OP tokens. Earned tokens are harvested, sold for more {{token}} which is deposited back into the strategy."
    },
    "el": {
      "name": "Aave Lender Optimizer",
      "description": "Supplies {{token}} to [AAVE v3](https://app.aave.com/home) to generate interest and earn OP tokens. Earned tokens are harvested, sold for more {{token}} which is deposited back into the strategy."
    },
    "tr": {
      "name": "Aave Lender Optimizer",
      "description": "Supplies {{token}} to [AAVE v3](https://app.aave.com/home) to generate interest and earn OP tokens. Earned tokens are harvested, sold for more {{token}} which is deposited back into the strategy."
    },
    "vi": {
      "name": "Aave Lender Optimizer",
      "description": "Supplies {{token}} to [AAVE v3](https://app.aave.com/home) to generate interest and earn OP tokens. Earned tokens are harvested, sold for more {{token}} which is deposited back into the strategy."
    },
    "zh": {
      "name": "Aave Lender Optimizer",
      "description": "Supplies {{token}} to [AAVE v3](https://app.aave.com/home) to generate interest and earn OP tokens. Earned tokens are harvested, sold for more {{token}} which is deposited back into the strategy."
    },
    "hi": {
      "name": "Aave Lender Optimizer",
      "description": "Supplies {{token}} to [AAVE v3](https://app.aave.com/home) to generate interest and earn OP tokens. Earned tokens are harvested, sold for more {{token}} which is deposited back into the strategy."
    },
    "ja": {
      "name": "Aave Lender Optimizer",
      "description": "Supplies {{token}} to [AAVE v3](https://app.aave.com/home) to generate interest and earn OP tokens. Earned tokens are harvested, sold for more {{token}} which is deposited back into the strategy."
    },
    "id": {
      "name": "Aave Lender Optimizer",
      "description": "Supplies {{token}} to [AAVE v3](https://app.aave.com/home) to generate interest and earn OP tokens. Earned tokens are harvested, sold for more {{token}} which is deposited back into the strategy."
    },
    "ru": {
      "name": "Aave Lender Optimizer",
      "description": "Supplies {{token}} to [AAVE v3](https://app.aave.com/home) to generate interest and earn OP tokens. Earned tokens are harvested, sold for more {{token}} which is deposited back into the strategy."
    }
  }
}
