{
  "$schema": "strategy",
  "name": "LiquityUSD Stability Pool Strategy",
  "description": "Supplies {{token}} to Liquity's Stability Pool to earn LQTY rewards and ETH (from trove liquidations). Earned tokens are harvested and sold for more {{token}} which is deposited back into the strategy.",
  "addresses": [
    "0x8ec4c06960c6BDBb4964D1830aC1355EE78401bD",
    "0xA9B6226C1Ea64a6515e5Ae572AC1D806cD956E26",
    "0xFf72f7C5f64ec2fd79B57d1A69C3311C1bB3EEF1"
  ],
  "protocols": ["Liquity"],
  "protocolVersion": {
    "Liquity": "1"
  },
  "localization": {
    "en": {
      "name": "LiquityUSD Stability Pool Strategy",
      "description": "Supplies {{token}} to Liquity's Stability Pool to earn LQTY rewards and ETH (from trove liquidations). Earned tokens are harvested and sold for more {{token}} which is deposited back into the strategy."
    },
    "fr": {
      "name": "LiquityUSD Stability Pool Strategy",
      "description": "Fournit du {{token}} sur la pool de stabilité de Liquity pour gagner des récompenses LQTY et des ETH (à partir de liquidations). Les jetons gagnés sont récoltés, vendus pour plus de {{token}} qui sont ensuite redéposés dans la stratégie."
    },
    "es": {
      "name": "LiquityUSD Stability Pool Strategy",
      "description": "Suministra {{token}} al grupo de estabilidad de Liquity para ganar recompensas LQTY y ETH (de liquidaciones de tesoros). Los tokens ganados se cosechan y venden por más {{token}} que se deposita nuevamente en la estrategia."
    },
    "de": {
      "name": "LiquityUSD Stability Pool Strategy",
      "description": "Supplies {{token}} to Liquity's Stability Pool to earn LQTY rewards and ETH (from trove liquidations). Earned tokens are harvested and sold for more {{token}} which is deposited back into the strategy."
    },
    "pt": {
      "name": "LiquityUSD Stability Pool Strategy",
      "description": "Supplies {{token}} to Liquity's Stability Pool to earn LQTY rewards and ETH (from trove liquidations). Earned tokens are harvested and sold for more {{token}} which is deposited back into the strategy."
    },
    "el": {
      "name": "LiquityUSD Stability Pool Strategy",
      "description": "Supplies {{token}} to Liquity's Stability Pool to earn LQTY rewards and ETH (from trove liquidations). Earned tokens are harvested and sold for more {{token}} which is deposited back into the strategy."
    },
    "tr": {
      "name": "LiquityUSD Stability Pool Strategy",
      "description": "LQTY ödülleri ve ETH(hazinedeki tasfiyelerinden) kazanmak için Liquity'nin Stability Havuzuna {{token}} sağlar. Kazanılan jetonlar toplanır ve stratejiye geri yatırılan daha fazla {{token}} karşılığında satılır."
    },
    "vi": {
      "name": "LiquityUSD Stability Pool Strategy",
      "description": "Supplies {{token}} to Liquity's Stability Pool to earn LQTY rewards and ETH (from trove liquidations). Earned tokens are harvested and sold for more {{token}} which is deposited back into the strategy."
    },
    "zh": {
      "name": "LiquityUSD Stability Pool Strategy",
      "description": "将 {{token}} 存入 Liquity 的稳定池赚取 LQTY 奖励和 ETH（来自清算）。收获代币后，卖掉换为更多的 {{token}} 并进行复投。"
    },
    "hi": {
      "name": "LiquityUSD Stability Pool Strategy",
      "description": "LQTY पुरस्कार और ETH (ट्रोव परिसमापन से) अर्जित करने के लिए Liquity के स्थिरता पूल को {{token}} की आपूर्ति करता है। अर्जित टोकन वसूल किया जाता है और अधिक {{token}} के लिए बेचा जाता है जिसे वापस रणनीति में जमा किया जाता है।"
    },
    "ja": {
      "name": "LiquityUSD Stability Pool Strategy",
      "description": "Supplies {{token}} to Liquity's Stability Pool to earn LQTY rewards and ETH (from trove liquidations). Earned tokens are harvested and sold for more {{token}} which is deposited back into the strategy."
    },
    "id": {
      "name": "LiquityUSD Stability Pool Strategy",
      "description": "Supplies {{token}} to Liquity's Stability Pool to earn LQTY rewards and ETH (from trove liquidations). Earned tokens are harvested and sold for more {{token}} which is deposited back into the strategy."
    },
    "ru": {
      "name": "LiquityUSD Stability Pool Strategy",
      "description": "Supplies {{token}} to Liquity's Stability Pool to earn LQTY rewards and ETH (from trove liquidations). Earned tokens are harvested and sold for more {{token}} which is deposited back into the strategy."
    }
  }
}
